{
    "id": "1234567890",
    "bidid": "162059897743978051070",
    "cur": "GBP",
    "seatbid": [{
            "seat": "512",
            "bid": [{
                    "id": "1",
                    "impid": "102",
                    "price": 9.43,
                    "nurl": "http://adserver.com/winnotice?impid=102&bidid=abc1123",
					"burl": "http://adserver.com/billingnotice?impid=102&bidid=abc1123&price=${AUCTION_PRICE}&multiplier=${AUCTION_MULTIPLIER}",
                    "iurl": "http://adserver.com/pathtosampleimage",
                    "adomain": ["advertiserdomain.com"],
                    "cid": "campaign111",
                    "crid": "creative112",
                    "attr": [1,2,3,4,5,6,7,12],
					"w": 1920,
                    "h": 1080,
                    "cat": ["IAB1"]
                }
            ]
        }
    ]
}
